{
  "name": "robot_city_night",
  "version": 1,
  "template": "street_scene",
  "description": "Robot / mech / android on a night street. Low dramatic angle, moody neon palette, traffic streaks. Where Blade Runner meets Ghost in the Shell.",
  "applies_when": {
    "env_subject": [
      "city",
      "cityscape",
      "street"
    ],
    "env_subject_tags": [
      "city",
      "urban",
      "street",
      "cyberpunk"
    ],
    "env_biome_hints": [
      "city_night",
      "city",
      "urban"
    ],
    "hero_category": [
      "character",
      "creature"
    ],
    "keywords_any": [
      "mech",
      "android",
      "cyborg",
      "cyberpunk"
    ],
    "keywords_all": [
      "robot"
    ],
    "has_forced_env": true
  },
  "layers": {
    "base": "preview_tier",
    "environment": "city_street",
    "composition": "low_wide_dramatic",
    "lighting": "cinematic_moody",
    "animation": "hero_idle_subtle",
    "ambient": "traffic_distant",
    "post": "cinematic_graded"
  },
  "overrides": {
    "lighting": {
      "key_energy_multiplier": 0.8,
      "hdri_keywords": [
        "night",
        "neon",
        "cyberpunk"
      ]
    }
  },
  "metadata": {
    "author": "team",
    "quality_tier": "cinematic"
  }
}
